{
  "acronym": [
    "elit",
    "reprehenderit tempor est adipisicing",
    "laborum ut fugiat",
    "commodo tempor anim consequat",
    "nisi nostrud"
  ],
  "address": [
    {
      "city": "cillum labore commodo sunt Duis",
      "country_code": "LY",
      "latitude": 97800481,
      "longitude": -29658712,
      "original address": "sed qui dolo",
      "postal_code": "aliquip nulla dolore",
      "state": "magna et irure"
    }
  ],
  "alternative_titles": [
    {
      "source": "do enim ea",
      "subtitle": "labore sint fugiat eiusmod Ut",
      "title": "Ut ea nisi ullamco"
    },
    {
      "source": "eiusmod esse",
      "subtitle": "Excepteur fugiat Lorem",
      "title": "in irure ea elit velit"
    },
    {
      "source": "aliquip minim et laboris do",
      "subtitle": "ut eu eiusmod",
      "title": "cillum"
    },
    {
      "source": "exercitation eiusmod in cupidatat",
      "subtitle": "culpa deserunt sit occaecat",
      "title": "sint consequat labore"
    },
    {
      "source": "Lorem Ut",
      "subtitle": "sit",
      "title": "esse consectetur Excepteur id voluptate"
    }
  ],
  "closing_date": "dddd-dd-dd",
  "cnum": "C09-69-94.621452586",
  "contact_details": [
    {
      "email": "Blh3wTTo@C.suji",
      "name": "sunt ullamco"
    },
    {
      "email": "29vrCfXZ@OeqAKmpucTR.vqq",
      "name": "reprehen"
    },
    {
      "email": "J3jJGkzRiSr@rANprtZEMkmtxGigztoVtR.ycz",
      "name": "dolor qui"
    }
  ],
  "deleted": true,
  "inspire_categories": [
    {
      "source": "curator",
      "term": "Accelerators"
    },
    {
      "source": "curator",
      "term": "Experiment-HEP"
    },
    {
      "source": "arxiv",
      "term": "Computing"
    },
    {
      "source": "undefined",
      "term": "Experiment-Nucl"
    }
  ],
  "keywords": [
    {
      "source": "quis",
      "value": "in labore veniam"
    },
    {
      "source": "dolor dolore et",
      "value": "sit"
    },
    {
      "source": "tempor aute non nisi",
      "value": "ea aute in"
    }
  ],
  "new_record": {
    "$ref": "http://1Zk:"
  },
  "nonpublic_note": "sit commodo velit",
  "note": [
    "deserunt in ipsum sit sint",
    "commodo",
    "cillum sint ullamco au",
    "exerc"
  ],
  "opening_date": "dddd-dd-dd",
  "place": "EPnDn/P,q,1 qz*.",
  "self": {
    "$ref": "http://1}\\Mm@@[q&"
  },
  "series": [
    {
      "name": "sit elit in",
      "number": 74403051
    }
  ],
  "short_description": [
    {
      "source": "dolore cupidatat Excepteur voluptate commodo",
      "value": "in eu Lorem ea consequat"
    },
    {
      "source": "dolor esse enim aute",
      "value": "in"
    },
    {
      "source": "anim sed non",
      "value": "Excepteur ea fugiat ut sunt"
    }
  ],
  "titles": [
    {
      "source": "proident et ut i",
      "subtitle": "mollit nostrud dolor consequat aute",
      "title": "commodo et irure laboris veniam"
    }
  ],
  "urls": [
    {
      "description": "proident dolor tempor sit et",
      "value": "http://1v2AfeQ\\"
    },
    {
      "description": "dolore laboris ullamco adipisicing",
      "value": "http://17nr7Sp"
    },
    {
      "description": "laboris nulla",
      "value": "http://1Jz\""
    },
    {
      "description": "tempor",
      "value": "http://1dE"
    },
    {
      "description": "tempor quis qui in",
      "value": "http://1"
    }
  ]
}